{
  "$schema": "typed-boundaries.schema.json",
  "schemaVersion": 1,
  "manifestId": "hxc-typed-boundaries-v1",
  "scope": {
    "files": "Every repository-owned .hx file in the checkout is scanned, including compiler, target API, fixtures, examples, templates, and future runtime tooling.",
    "excludedRoots": [
      ".beads",
      ".git",
      ".hxc",
      "node_modules",
      "runtime/third_party",
      "runtime/vendor",
      "third_party",
      "vendor"
    ],
    "policy": "Untyped values never enter semantic compiler logic. An unavoidable external or negative-test boundary is exact-source allowlisted, validates immediately into the named closed model, and has malformed-input evidence."
  },
  "constructs": [
    {
      "id": "any-type",
      "description": "Haxe Any erases the static value contract."
    },
    {
      "id": "dynamic-type",
      "description": "Haxe Dynamic defers member and conversion checks."
    },
    {
      "id": "json-parse",
      "description": "haxe.Json.parse returns an untyped external value."
    },
    {
      "id": "open-record",
      "description": "DynamicAccess is an open-ended string-keyed value carrier."
    },
    {
      "id": "private-access",
      "description": "Private-access metadata bypasses the declared visibility contract."
    },
    {
      "id": "raw-code-injection",
      "description": "Raw __c__ calls bypass typed IR and structural C AST lowering."
    },
    {
      "id": "reflect-api",
      "description": "Reflect member access replaces a known structural type with runtime lookup."
    },
    {
      "id": "unchecked-cast",
      "description": "The Haxe cast keyword can assert a type without validating the value shape."
    },
    {
      "id": "untyped-keyword",
      "description": "The Haxe untyped keyword disables ordinary type checking."
    }
  ],
  "allowlist": [
    {
      "path": "src/reflaxe/c/emit/ReflaxeOutputWriter.hx",
      "line": 109,
      "column": 46,
      "construct": "json-parse",
      "boundaryKind": "external-json",
      "symbol": "ReflaxeOutputWriter.decodeOwnershipMetadata",
      "typedModel": "ReflaxeOwnershipMetadata",
      "sourceLine": "final metadata:ReflaxeOwnershipMetadata = Json.parse(File.getContent(metadataPath));",
      "justification": "The reviewed Reflaxe ownership file is external JSON and the pinned Haxe parser necessarily returns an untyped value.",
      "validation": "The adapter immediately checks schema version, activity scalar types, the generated-file array, every string entry, path normalization, duplicates, and ownership-manifest exclusion before returning the closed record.",
      "testEvidence": [
        "test/project_emitter/run.py"
      ]
    },
    {
      "path": "test/aggregate_lowering/fixtures/dynamic/Main.hx",
      "line": 4,
      "column": 31,
      "construct": "dynamic-type",
      "boundaryKind": "negative-test",
      "symbol": "Main.value",
      "typedModel": "CBodyValueType",
      "sourceLine": "static function value(record:Dynamic):Int {",
      "justification": "The negative aggregate fixture must present the real Haxe Dynamic semantic type to prove it cannot masquerade as a structurally known value record.",
      "validation": "CBodyLowering rejects the signature before constructing HxcIR and the aggregate suite requires exact source-positioned HXC1001 with no generated artifact.",
      "testEvidence": [
        "test/aggregate_lowering/run.py"
      ]
    },
    {
      "path": "test/arithmetic_semantics/fixtures/ArithmeticFixture.hx",
      "line": 119,
      "column": 19,
      "construct": "unchecked-cast",
      "boundaryKind": "language-semantics-fixture",
      "symbol": "ArithmeticFixture.intQuotientThroughFloatCast",
      "typedModel": "Float expression and validated HxcIR arithmetic operations",
      "sourceLine": "return Std.int((cast(value / 8) : Float));",
      "justification": "The fixture needs a real cast node to check that cast-wrapped division stays outside the direct integer-division proof. The operand already has type Float; the cast introduces no foreign value.",
      "validation": "The arithmetic suite requires the general floating division operation in HxcIR. Its strict native harness independently checks that input 47 returns 5.",
      "testEvidence": [
        "test/arithmetic_semantics/run.py"
      ]
    },
    {
      "path": "test/diagnostics/DiagnosticGolden.hx",
      "line": 45,
      "column": 27,
      "construct": "unchecked-cast",
      "boundaryKind": "negative-test",
      "symbol": "DiagnosticGolden.main",
      "typedModel": "CDiagnosticId",
      "sourceLine": "CDiagnostic.definition(cast(\"HXC\" + \"1234\"));",
      "justification": "The negative test must forge an impossible enum-abstract value to prove the typed diagnostic registry rejects unallocated IDs.",
      "validation": "The forged value is used only for the rejecting call and the fixture fails unless CDiagnostic.definition throws.",
      "testEvidence": [
        "test/diagnostics/run.py"
      ]
    },
    {
      "path": "test/differential/dynamic-runtime/discovery/Main.hx",
      "line": 24,
      "column": 23,
      "construct": "unchecked-cast",
      "boundaryKind": "language-semantics-fixture",
      "symbol": "Main.main.castCallee",
      "typedModel": "Int->Int static function",
      "sourceLine": "final castCallee = (cast increment : Int->Int)(5);",
      "justification": "The language fixture casts an already typed Int->Int function to the same type to exercise source call syntax without introducing a foreign value.",
      "validation": "The focused discovery lane checks independently specified Eval output, both generic specializations, Dynamic IR operations, strict native O0/O2 output, sanitizers, and unavailable-target diagnostics with no emitted output.",
      "testEvidence": [
        "test/differential/dynamic-runtime/run.py"
      ]
    },
    {
      "path": "test/differential/dynamic-runtime/discovery/Main.hx",
      "line": 28,
      "column": 16,
      "construct": "dynamic-type",
      "boundaryKind": "language-semantics-fixture",
      "symbol": "Main.main.boxed",
      "typedModel": "HxcIRDynamicPlan and Float scalar adapters",
      "sourceLine": "final boxed:Dynamic = 9.75;",
      "justification": "The fixture needs a real Dynamic Float boundary nested inside an intrinsic argument to prove discovery still traverses arguments when no prepared static target exists.",
      "validation": "The focused discovery lane checks independently specified Eval output, both generic specializations, Dynamic IR operations, strict native O0/O2 output, sanitizers, and unavailable-target diagnostics with no emitted output.",
      "testEvidence": [
        "test/differential/dynamic-runtime/run.py"
      ]
    },
    {
      "path": "test/differential/dynamic-runtime/discovery/Main.hx",
      "line": 32,
      "column": 23,
      "construct": "dynamic-type",
      "boundaryKind": "language-semantics-fixture",
      "symbol": "Main.main.boxedArgument",
      "typedModel": "HxcIRDynamicPlan and Int scalar adapters",
      "sourceLine": "final boxedArgument:Dynamic = 10;",
      "justification": "The fixture needs a real Dynamic Int argument to prove exact static targets retain their parameter conversion discovery.",
      "validation": "The focused discovery lane checks independently specified Eval output, both generic specializations, Dynamic IR operations, strict native O0/O2 output, sanitizers, and unavailable-target diagnostics with no emitted output.",
      "testEvidence": [
        "test/differential/dynamic-runtime/run.py"
      ]
    },
    {
      "path": "test/differential/dynamic-runtime/fixtures/Main.hx",
      "line": 2,
      "column": 36,
      "construct": "dynamic-type",
      "boundaryKind": "language-semantics-fixture",
      "symbol": "ReferenceDynamic",
      "typedModel": "HxcIRDynamicPlan, HxcIRDynamicOperation, and generated hxrt_value adapters",
      "sourceLine": "private typedef ReferenceDynamic = Dynamic;",
      "justification": "The differential fixture must use the real Haxe Dynamic type so Eval and generated C exercise the same boxes, casts, member operations, calls, equality, null, and type-value behavior.",
      "validation": "One private alias contains the untyped spelling; the Dynamic differential compares Eval with strict native C, checks forced-collection ownership, verifies closed numeric adapters, and rejects unsupported shapes without output.",
      "testEvidence": [
        "test/differential/dynamic-runtime/run.py"
      ]
    },
    {
      "path": "test/differential/dynamic-runtime/negative/arithmetic/Main.hx",
      "line": 11,
      "column": 19,
      "construct": "dynamic-type",
      "boundaryKind": "negative-test",
      "symbol": "Main.main.numerator",
      "typedModel": "CBodyValueType and validated HxcIR primitive operations",
      "sourceLine": "final numerator:Dynamic = 47;",
      "justification": "The fixture needs a real Dynamic operand to prove that runtime-typed division cannot enter the signed-Int optimization. Replacing it with Int would remove the rejecting case.",
      "validation": "The Dynamic differential requires source-positioned HXC1001 with the exact unsupported division marker. It also requires that no generated output remains.",
      "testEvidence": [
        "test/differential/dynamic-runtime/run.py"
      ]
    },
    {
      "path": "test/differential/dynamic-runtime/negative/bound-method/Main.hx",
      "line": 15,
      "column": 17,
      "construct": "dynamic-type",
      "boundaryKind": "negative-test",
      "symbol": "Main.main.counter",
      "typedModel": "closed generated Dynamic adapters without capturing closures",
      "sourceLine": "final counter:Dynamic = new Counter();",